<?xml version="1.0" encoding="utf-8"?>
<classes xmlns:xsi="http://www.w3.org/2001/XMLSchema-instance" xsi:noNamespaceSchemaLocation="./classValidation.xsd">
  <stdClass>
    <id>4</id>
    <name>html</name>
    <teacherId>3</teacherId>
  </stdClass>
  <stdClass>
    <id>5</id>
    <name>ooo</name>
    <teacherId>3</teacherId>
  </stdClass>
  <stdClass>
    <id>6</id>
    <name>kkk</name>
    <teacherId>3</teacherId>
  </stdClass>
  <stdClass>
    <id>7</id>
    <name>iiiikjh</name>
    <teacherId>3</teacherId>
  </stdClass>
  <stdClass>
    <id>8</id>
    <name>bbjk</name>
    <teacherId>4</teacherId>
  </stdClass>
  <stdClass>
    <id>9</id>
    <name>htii</name>
    <teacherId>3</teacherId>
  </stdClass>
  <stdClass>
    <id>10</id>
    <name>html</name>
    <teacherId>14</teacherId>
  </stdClass>
  <stdClass>
    <id>11</id>
    <name>js</name>
    <teacherId>15</teacherId>
  </stdClass>
</classes>